{
  "chapter": 74,
  "part": "德經",
  "gist": "民不畏死，奈何以死懼之；代大匠斲者，希有不傷其手",
  "text": "民不畏死，奈何以死懼之？若使民常畏死，而為奇者，吾得執而殺之，孰敢？常有司殺者殺。夫代司殺者殺，是謂代大匠斲。夫代大匠斲者，希有不傷其手矣。",
  "segments": [
    {
      "id": "74.1",
      "text": "民不畏死，奈何以死懼之？",
      "plain": "百姓連死都不怕了，拿死來嚇他們有什麼用？"
    },
    {
      "id": "74.2",
      "text": "若使民常畏死，而為奇者，吾得執而殺之，孰敢？",
      "plain": "假使百姓真的怕死，有人搞怪作亂，我把他抓來殺掉，誰還敢？"
    },
    {
      "id": "74.3",
      "text": "常有司殺者殺。夫代司殺者殺，是謂代大匠斲。",
      "plain": "向來有專管殺的在殺。代替那個專管殺的去殺，就叫作代替大木匠去砍木頭。"
    },
    {
      "id": "74.4",
      "text": "夫代大匠斲者，希有不傷其手矣。",
      "plain": "代替大木匠砍木頭的，很少有不砍傷自己手的。"
    }
  ],
  "plain": "百姓連死都不怕了，拿死來嚇他們有什麼用？假使百姓真的怕死，有人搞怪作亂，我把他抓來殺掉，那誰還敢？可是向來自有專管殺的在殺——代替那個專管殺的去殺，就叫作代替大木匠去砍木頭。而代替大木匠砍木頭的人，很少有不砍傷自己手的。",
  "notes": [
    {
      "id": "n1",
      "ref": "74.1",
      "type": "互見",
      "text": "與第 72 章「民不畏威，則大威至」是同一個推論往前推一步：威嚇有效的前提是對方還有在乎的東西。連死都不怕時，刑罰這套工具本身就失效了——不是要不要用的問題，是用不動了。",
      "see": [
        "72.1"
      ]
    },
    {
      "id": "n2",
      "ref": "74.2",
      "term": "為奇者",
      "type": "訓詁",
      "text": "奇是不正、出格。「為奇者」指搞怪作亂的人。這一句用假設語氣，語氣是冷的：就算這套真的有效，下一句也要問——憑什麼是你來殺。"
    },
    {
      "id": "n3",
      "ref": "74.3",
      "term": "司殺者",
      "type": "訓詁",
      "text": "司是掌管。司殺者指專管生死的那個力量（天、或自然的運行）。老子的意思不是廢除刑罰，而是說生死自有其歸屬，統治者把它接到自己手上，就是越界。"
    },
    {
      "id": "n4",
      "ref": "74.4",
      "term": "代大匠斲",
      "type": "義理",
      "text": "全書最狠的一個比喻，而且狠在務實：不說你不該殺，只說你手會受傷。斲是砍削，大匠的活外行接不了——越界的人第一個傷到的是自己。第 57 章「法令滋彰，盜賊多有」是同一種論證，不談應不應該，只講會怎樣。",
      "see": [
        "57.3"
      ]
    }
  ],
  "keywords": [],
  "meta": {
    "status": "draft",
    "base": "王弼本",
    "updated": "2026-09-14",
    "todo": [
      "白話待口述改寫（目前為起草稿）",
      "本章原文裡的受控詞（常／有）都是語法義，照原則 6 不標；不在關鍵詞索引中是刻意的，全文搜尋可涵蓋"
    ]
  }
}
