{
  "chapter": 62,
  "part": "德經",
  "gist": "道者萬物之奧；人之不善，何棄之有；不如坐進此道",
  "text": "道者萬物之奧，善人之寶，不善人之所保。美言可以市尊，美行可以加人。人之不善，何棄之有？故立天子，置三公，雖有拱璧以先駟馬，不如坐進此道。古之所以貴此道者何？不曰：求以得，有罪以免邪？故為天下貴。",
  "segments": [
    {
      "id": "62.1",
      "text": "道者萬物之奧，善人之寶，不善人之所保。",
      "plain": "道是萬物的庇蔭處，是善人的寶貝，也是不善之人賴以保全的東西。"
    },
    {
      "id": "62.2",
      "text": "美言可以市尊，美行可以加人。人之不善，何棄之有？",
      "plain": "好話可以換來尊敬，好的行為可以見重於人。那麼不善的人，又哪有該丟掉的道理？"
    },
    {
      "id": "62.3",
      "text": "故立天子，置三公，雖有拱璧以先駟馬，不如坐進此道。",
      "plain": "所以立天子、設三公的時候，就算捧著大璧、前面還駕著四匹馬去獻，不如就坐著把這個道進獻上去。"
    },
    {
      "id": "62.4",
      "text": "古之所以貴此道者何？不曰：求以得，有罪以免邪？故為天下貴。",
      "plain": "古人為什麼看重這個道？不就是說：求它就得得到，有罪也能因它免除嗎？所以它為天下所貴重。"
    }
  ],
  "plain": "道是萬物的庇蔭處，是善人的寶貝，也是不善之人賴以保全的東西。好話可以換來尊敬，好的行為可以見重於人——那麼不善的人，又哪有該丟掉的道理？所以立天子、設三公的時候，就算捧著大璧、前面駕著四匹馬去獻，也不如就坐著把這個道進獻上去。古人為什麼看重這個道？不就是說：求它就得得到，有罪也能因它免除嗎？所以它為天下所貴重。",
  "notes": [
    {
      "id": "n1",
      "ref": "62.1",
      "term": "奧",
      "type": "訓詁",
      "text": "奧本指屋子西南角，是室內最深、最受蔽護的地方，引申為庇蔭處、藏身處。說道是萬物之奧，是說萬物都在它底下待著——不是崇高的頂點，是深處的角落。"
    },
    {
      "id": "n2",
      "ref": "62.1",
      "term": "不善人之所保",
      "type": "互見",
      "text": "道不只屬於善人。第 27 章「常善救人，故無棄人」、第 49 章「不善者吾亦善之」都是這個立場：老子從不把人分成該留的與該丟的。",
      "see": ["27.2", "49.2"]
    },
    {
      "id": "n3",
      "ref": "62.2",
      "term": "何棄之有",
      "type": "義理",
      "text": "推理很直接：既然漂亮話、漂亮事都能換到尊重，那麼連不善的人也還有可取之處，怎麼會有非丟不可的人？這是第 27 章「不善人者，善人之資」的另一種講法。",
      "see": ["27.3"]
    },
    {
      "id": "n4",
      "ref": "62.3",
      "term": "拱璧以先駟馬",
      "type": "訓詁",
      "text": "拱璧是雙手才抱得住的大玉，駟馬是四匹馬拉的車——古代最重的獻禮。老子把它和「坐進此道」擺在一起比：最貴重的東西不必搬運，坐著就能送出去。"
    },
    {
      "id": "n5",
      "ref": "62.4",
      "term": "為天下貴",
      "type": "互見",
      "text": "「故為天下貴」與第 56 章末句同文。那裡貴的是玄同的人，這裡貴的是道——兩處都用同一個結語，指向同一種貴：不靠外物加持的貴。",
      "see": ["56.4"]
    }
  ],
  "keywords": [
    { "term": "道", "refs": ["62.1", "62.3", "62.4"], "sense": "萬物所藏身處" },
    { "term": "萬物", "refs": ["62.1"] },
    { "term": "善", "refs": ["62.1", "62.2"] },
    { "term": "天下", "refs": ["62.4"] }
  ],
  "meta": {
    "status": "draft",
    "base": "王弼本",
    "updated": "2026-09-14",
    "todo": ["白話待口述改寫（目前為起草稿）"]
  }
}
