{
  "chapter": 45,
  "part": "德經",
  "gist": "大成若缺，大盈若沖，大巧若拙；清靜為天下正",
  "text": "大成若缺，其用不弊。大盈若沖，其用不窮。大直若屈，大巧若拙，大辯若訥。躁勝寒，靜勝熱，清靜為天下正。",
  "segments": [
    {
      "id": "45.1",
      "text": "大成若缺，其用不弊。",
      "plain": "最成全的東西看起來像有缺，可是怎麼用都不壞。"
    },
    {
      "id": "45.2",
      "text": "大盈若沖，其用不窮。",
      "plain": "最充盈的東西看起來像空的，可是怎麼用都不盡。"
    },
    {
      "id": "45.3",
      "text": "大直若屈，大巧若拙，大辯若訥。",
      "plain": "最直的看起來像彎，最巧的看起來像笨，最會說的看起來像說不出話。"
    },
    {
      "id": "45.4",
      "text": "躁勝寒，靜勝熱，清靜為天下正。",
      "plain": "動起來勝得過寒，靜下來勝得過熱；清靜才是天下的正道。"
    }
  ],
  "plain": "最成全的東西看起來像有缺，可是怎麼用都不壞；最充盈的東西看起來像空的，可是怎麼用都不盡。最直的像彎，最巧的像笨，最會說的像說不出話。動起來勝得過寒，靜下來勝得過熱——而清靜，才是天下的正道。",
  "notes": [
    {
      "id": "n1",
      "ref": "45.1",
      "type": "互見",
      "text": "五個「大某若某」是全書「正言若反」最密集的一段，第 78 章末句那四個字正是替這類句子作的總說明；第 22 章「曲則全，枉則直」是同一種排比的另一組。",
      "see": ["78.4", "22.1"]
    },
    {
      "id": "n2",
      "ref": "45.2",
      "term": "沖",
      "type": "互見",
      "text": "沖即虛。「大盈若沖，其用不窮」幾乎就是第 4 章「道沖，而用之或不盈」的翻版——一個說道，一個說一切夠大的東西，道理相同：空著才用不完。",
      "see": ["4.1"]
    },
    {
      "id": "n3",
      "ref": "45.3",
      "term": "大辯若訥",
      "type": "互見",
      "text": "訥是說話遲鈍。這句與第 81 章「善者不辯，辯者不善」、第 56 章「知者不言，言者不知」是同一條線：真有內容的人不靠口舌取勝。",
      "see": ["81.2", "56.1"]
    },
    {
      "id": "n4",
      "ref": "45.4",
      "term": "躁勝寒，靜勝熱",
      "type": "異讀",
      "text": "兩句歷來有錯簡之疑，也有主張當作「靜勝躁，寒勝熱」者。就今本讀：活動起來能抗寒，安靜下來能解熱——兩者各有用處，但下一句只取靜那一邊，可見重點在「靜」。"
    },
    {
      "id": "n5",
      "ref": "45.4",
      "term": "清靜為天下正",
      "type": "互見",
      "text": "「靜」這條線：第 16 章「守靜篤」是工夫，第 57 章「我好靜而民自正」是治理的效果，這裡則直接立為天下的正道。三處合看，靜在老子這裡不是狀態而是位置。",
      "see": ["16.1", "57.4"]
    }
  ],
  "keywords": [
    { "term": "天下", "refs": ["45.4"] }
  ],
  "meta": {
    "status": "draft",
    "base": "王弼本",
    "updated": "2026-09-14",
    "todo": ["白話待口述改寫（目前為起草稿）"]
  }
}
