{
  "chapter": 53,
  "part": "德經",
  "gist": "大道甚夷而民好徑；朝甚除、田甚蕪、倉甚虛，是謂盜夸",
  "text": "使我介然有知，行於大道，唯施是畏。大道甚夷，而民好徑。朝甚除，田甚蕪，倉甚虛；服文綵，帶利劍，厭飲食，財貨有餘，是謂盜夸。非道也哉！",
  "segments": [
    {
      "id": "53.1",
      "text": "使我介然有知，行於大道，唯施是畏。",
      "plain": "假使我稍微有點認識，走在大道上，最怕的就是走上斜路。"
    },
    {
      "id": "53.2",
      "text": "大道甚夷，而民好徑。",
      "plain": "大道平坦得很，人偏偏愛抄小路。"
    },
    {
      "id": "53.3",
      "text": "朝甚除，田甚蕪，倉甚虛；服文綵，帶利劍，厭飲食，財貨有餘，是謂盜夸。非道也哉！",
      "plain": "朝廷打掃得乾乾淨淨，田地卻荒著，倉庫卻空著；身上穿著錦繡，腰間佩著利劍，吃得膩了，財貨還有剩——這叫強盜頭子。這不是道啊！"
    }
  ],
  "plain": "假使我稍微有點認識，走在大道上，最怕的就是走上斜路。大道明明平坦得很，人偏偏愛抄小路。你看：朝廷打掃得乾乾淨淨，田地卻荒著，倉庫卻空著；身上穿著錦繡，腰間佩著利劍，吃得膩了，財貨還有剩——這叫強盜頭子。這哪裡是道！",
  "notes": [
    {
      "id": "n1",
      "ref": "53.1",
      "term": "施",
      "type": "訓詁",
      "text": "施在此讀 yí，通「迤」，指斜行、走偏。全章就從這個字展開：路是直的，人自己拐出去。"
    },
    {
      "id": "n2",
      "ref": "53.2",
      "term": "夷",
      "type": "互見",
      "text": "夷是平。第 41 章「夷道若纇」說平坦的道看起來像崎嶇，這裡說大道本來就平坦——兩章合看：路不難走，難的是人不肯走平的那條。",
      "see": ["41.2"]
    },
    {
      "id": "n3",
      "ref": "53.3",
      "term": "盜夸",
      "type": "訓詁",
      "text": "夸即誇大、為首。盜夸就是強盜頭子。老子罵得很直：田荒倉空而朝廷華美、上位者衣食有餘，這不叫治理，這叫搶。"
    },
    {
      "id": "n4",
      "ref": "53.3",
      "type": "互見",
      "text": "這一段的實況，正是第 77 章「人之道則不然，損不足以奉有餘」的具體樣子。那裡下判斷，這裡舉現場——兩章合讀，老子對當時分配狀況的態度沒有任何模糊。",
      "see": ["77.2"]
    }
  ],
  "keywords": [
    { "term": "知", "refs": ["53.1"] },
    { "term": "道", "refs": ["53.1", "53.2", "53.3"], "sense": "以大道與斜徑對舉" },
    { "term": "有", "refs": ["53.3"] }
  ],
  "meta": {
    "status": "draft",
    "base": "王弼本",
    "updated": "2026-09-14",
    "todo": ["白話待口述改寫（目前為起草稿）"]
  }
}
