{
  "chapter": 23,
  "part": "道經",
  "gist": "希言自然；飄風不終朝，天地尚不能久；同於道者道亦樂得之",
  "text": "希言自然。故飄風不終朝，驟雨不終日。孰為此者？天地。天地尚不能久，而況於人乎？故從事於道者，道者同於道，德者同於德，失者同於失。同於道者，道亦樂得之；同於德者，德亦樂得之；同於失者，失亦樂得之。信不足焉，有不信焉。",
  "segments": [
    {
      "id": "23.1",
      "text": "希言自然。",
      "plain": "少發號令，才合乎本來的樣子。"
    },
    {
      "id": "23.2",
      "text": "故飄風不終朝，驟雨不終日。孰為此者？天地。天地尚不能久，而況於人乎？",
      "plain": "所以狂風颳不了一個早上，暴雨下不了一整天。這是誰弄出來的？天地。連天地都持久不了，何況是人？"
    },
    {
      "id": "23.3",
      "text": "故從事於道者，道者同於道，德者同於德，失者同於失。",
      "plain": "所以在道上用功的人：走道的就與道同類，修德的就與德同類，走失的就與失同類。"
    },
    {
      "id": "23.4",
      "text": "同於道者，道亦樂得之；同於德者，德亦樂得之；同於失者，失亦樂得之。",
      "plain": "與道同類的，道也樂於接納他；與德同類的，德也樂於接納他；與失同類的，失也樂於接納他。"
    },
    {
      "id": "23.5",
      "text": "信不足焉，有不信焉。",
      "plain": "誠信不足，就有人不信你。"
    }
  ],
  "plain": "少發號令，才合乎本來的樣子。所以狂風颳不了一個早上，暴雨下不了一整天——這是誰弄出來的？天地。連天地弄出來的猛烈東西都持久不了，何況是人。所以在道上用功的人：走道的就與道同類，修德的就與德同類，走失的就與失同類；而與道同類的，道也樂於接納他，與德同類的，德也樂於接納他，與失同類的，失也一樣樂於接納他。誠信不足，自然就有人不信你。",
  "notes": [
    {
      "id": "n1",
      "ref": "23.1",
      "term": "希言",
      "type": "互見",
      "text": "希是少（第 14 章「聽之不聞，名曰希」、第 41 章「大音希聲」同此字）。「希言」指少發政令——與第 5 章「多言數窮」、第 2 章「行不言之教」同一條線。",
      "see": ["5.3", "2.3"]
    },
    {
      "id": "n2",
      "ref": "23.1",
      "term": "自然",
      "type": "互見",
      "text": "自然是「自己本來如此」。少發號令才不去干擾那個「自己如此」——第 64 章「輔萬物之自然」、第 25 章「道法自然」、第 51 章「莫之命而常自然」都在這條線上。",
      "see": ["64.6", "25.6", "51.3"]
    },
    {
      "id": "n3",
      "ref": "23.2",
      "type": "義理",
      "text": "狂風暴雨是天地做得最用力的時候，偏偏最短命。老子用它證明一件事：凡是使猛力的都不能久——第 76 章「兵強則滅，木強則折」是同一個判斷。政令頻繁正是人間的飄風驟雨。",
      "see": ["76.4"]
    },
    {
      "id": "n4",
      "ref": "23.3",
      "term": "同於失者",
      "type": "訓詁",
      "text": "失是失道、走丟了的狀態。三句的結構一樣，意思卻冷：你靠近什麼，什麼就接納你——包括走失。老子不說報應，只說同類相聚。"
    },
    {
      "id": "n5",
      "ref": "23.4",
      "type": "義理",
      "text": "「道亦樂得之」的主詞是道。不是你努力去求道，是你成了那一類，道自然就收你——與第 32 章「萬物將自賓」、第 57 章「民自化」的句法一致：成效永遠寫在對方身上。",
      "see": ["32.2", "57.4"]
    },
    {
      "id": "n6",
      "ref": "23.5",
      "type": "異讀",
      "text": "這兩句與第 17 章末尾重出，在本章接得有些突兀，歷來有疑為錯簡竄入者。若照字面讀，它補的是一個條件：上面說少發號令，但少發號令要靠得住，前提是本身有信。"
    }
  ],
  "keywords": [
    { "term": "自然", "refs": ["23.1"] },
    { "term": "天地", "refs": ["23.2"] },
    { "term": "道", "refs": ["23.3", "23.4"], "sense": "以同類相從說" },
    { "term": "德", "refs": ["23.3", "23.4"] },
    { "term": "信", "refs": ["23.5"] }
  ],
  "meta": {
    "status": "draft",
    "base": "王弼本",
    "updated": "2026-09-14",
    "todo": ["白話待口述改寫（目前為起草稿）"]
  }
}
