{
  "chapter": 28,
  "part": "道經",
  "gist": "知雄守雌、知白守黑、知榮守辱；復歸於嬰兒、無極、樸",
  "text": "知其雄，守其雌，為天下谿。為天下谿，常德不離，復歸於嬰兒。知其白，守其黑，為天下式。為天下式，常德不忒，復歸於無極。知其榮，守其辱，為天下谷。為天下谷，常德乃足，復歸於樸。樸散則為器，聖人用之，則為官長，故大制不割。",
  "segments": [
    {
      "id": "28.1",
      "text": "知其雄，守其雌，為天下谿。為天下谿，常德不離，復歸於嬰兒。",
      "plain": "知道什麼是雄強，卻守在雌柔那邊，就成了天下的溪流。成了天下的溪流，常德就不會離開，回到嬰兒的狀態。"
    },
    {
      "id": "28.2",
      "text": "知其白，守其黑，為天下式。為天下式，常德不忒，復歸於無極。",
      "plain": "知道什麼是明白，卻守在暗處，就成了天下的準則。成了天下的準則，常德就不會有差錯，回到沒有邊際的狀態。"
    },
    {
      "id": "28.3",
      "text": "知其榮，守其辱，為天下谷。為天下谷，常德乃足，復歸於樸。",
      "plain": "知道什麼是榮耀，卻守在屈辱那邊，就成了天下的山谷。成了天下的山谷，常德才充足，回到未雕的樸。"
    },
    {
      "id": "28.4",
      "text": "樸散則為器，聖人用之，則為官長，故大制不割。",
      "plain": "樸一旦散開就成了器物；聖人用它，就成了百官之長。所以最大的制作不去切割。"
    }
  ],
  "plain": "知道什麼是雄強，卻守在雌柔那邊，就成了天下的溪流；成了溪流，常德不離，回到嬰兒的狀態。知道什麼是明白，卻守在暗處，就成了天下的準則；成了準則，常德不出差錯，回到沒有邊際的狀態。知道什麼是榮耀，卻守在屈辱那邊，就成了天下的山谷；成了山谷，常德才充足，回到未經雕鑿的樸。樸一旦散開就成了各種器物；聖人用它，就成了百官之長——所以最大的制作，是不去切割。",
  "notes": [
    {
      "id": "n1",
      "ref": "28.1",
      "term": "知其雄，守其雌",
      "type": "義理",
      "text": "三段的關鍵都在「知」與「守」的落差：不是不懂雄強、明白、榮耀的好處，是懂了之後仍然守在另一邊。老子要的從來不是無知者的柔弱，是知道了還選擇不去搶的那種柔弱。"
    },
    {
      "id": "n2",
      "ref": "28.1",
      "term": "谿、谷",
      "type": "互見",
      "text": "溪與谷都是水往下匯集的地方，取的是「居下而眾流歸之」——第 66 章「江海所以能為百谷王者，以其善下之」、第 32 章「猶川谷之於江海」是同一個意象。",
      "see": ["66.1", "32.5"]
    },
    {
      "id": "n3",
      "ref": "28.2",
      "term": "為天下式",
      "type": "互見",
      "text": "「式」是可以照著做的準則，第 22 章「聖人抱一為天下式」用的是同一個詞。那裡守的是一，這裡守的是黑——都是守住不顯眼的那一邊。",
      "see": ["22.2"]
    },
    {
      "id": "n4",
      "ref": "28.2",
      "type": "異讀",
      "text": "「知其白，守其黑」這一段的句式與前後兩段不盡一致（「無極」與嬰兒、樸不同類），歷來有疑其為後人增入者。存疑備考，不影響三段共同的結構。"
    },
    {
      "id": "n5",
      "ref": "28.3",
      "term": "復歸",
      "type": "互見",
      "text": "三段各有一個歸宿：嬰兒、無極、樸，方向一致——往回走，回到還沒有分化的狀態。第 16 章「各復歸其根」是同一個動作的總說。",
      "see": ["16.3"]
    },
    {
      "id": "n6",
      "ref": "28.4",
      "term": "樸散則為器",
      "type": "互見",
      "text": "樸是未雕的原木，一經雕鑿就成了各有用途的器物——也就有了名分與高下。第 32 章「始制有名」講的正是這一刻：分化一開始，就該知道在哪裡停。",
      "see": ["32.4"]
    },
    {
      "id": "n7",
      "ref": "28.4",
      "term": "大制不割",
      "type": "訓詁",
      "text": "制是裁製、制作，割是切開。最高明的制作不在切割上見功夫——呼應上句：樸一散就回不去了，所以真正的治理是盡量不去分割。"
    }
  ],
  "keywords": [
    { "term": "知", "refs": ["28.1", "28.2", "28.3"] },
    { "term": "天下", "refs": ["28.1", "28.2", "28.3"] },
    { "term": "常", "refs": ["28.1", "28.2", "28.3"] },
    { "term": "德", "refs": ["28.1", "28.2", "28.3"] },
    { "term": "聖人", "refs": ["28.4"] },
    { "term": "樸", "refs": ["28.3", "28.4"] }
  ],
  "meta": {
    "status": "draft",
    "base": "王弼本",
    "updated": "2026-09-14",
    "todo": ["白話待口述改寫（目前為起草稿）"]
  }
}
