{
  "chapter": 36,
  "part": "道經",
  "gist": "將欲歙之必固張之，是謂微明；柔弱勝剛強",
  "text": "將欲歙之，必固張之；將欲弱之，必固強之；將欲廢之，必固興之；將欲取之，必固與之。是謂微明。柔弱勝剛強。魚不可脫於淵，國之利器不可以示人。",
  "segments": [
    {
      "id": "36.1",
      "text": "將欲歙之，必固張之；將欲弱之，必固強之；將欲廢之，必固興之；將欲取之，必固與之。",
      "plain": "要收合它，本來就得先張開；要削弱它，本來就得先強盛；要廢掉它，本來就得先興起；要取走它，本來就得先給予。"
    },
    {
      "id": "36.2",
      "text": "是謂微明。",
      "plain": "這叫作微明。"
    },
    {
      "id": "36.3",
      "text": "柔弱勝剛強。",
      "plain": "柔弱勝過剛強。"
    },
    {
      "id": "36.4",
      "text": "魚不可脫於淵，國之利器不可以示人。",
      "plain": "魚離不開深水，國家的利器不可以拿給人看。"
    }
  ],
  "plain": "要收合它，本來就得先張開；要削弱它，本來就得先強盛；要廢掉它，本來就得先興起；要取走它，本來就得先給予——這叫作微明。柔弱勝過剛強。魚離不開深水，國家的利器也不可以拿出來給人看。",
  "notes": [
    {
      "id": "n1",
      "ref": "36.1",
      "term": "固",
      "type": "異讀",
      "text": "全章的關鍵字。「固」讀為「本來、必定」，四句就是描述規律：任何東西收合之前必先張到極處，這與第 40 章「反者道之動」完全一致。「固」若讀為「姑」（姑且），四句就成了操作指南：想拿走就先給他——韓非以下讀成權術，多半從這一讀來。兩讀之間差的是一部書的性質。"
    },
    {
      "id": "n2",
      "ref": "36.1",
      "type": "互見",
      "text": "若依前一讀，本章講的正是第 40 章「反者道之動」：走到極處必然折返。第 25 章「大曰逝，逝曰遠，遠曰反」是同一條軌跡的另一種說法。",
      "see": ["40.1", "25.4"]
    },
    {
      "id": "n3",
      "ref": "36.2",
      "term": "微明",
      "type": "訓詁",
      "text": "微是幽微，明是看得清。微明就是「在還看不出來的時候就看清楚了」——第 52 章「見小曰明」說的是同一種眼力。",
      "see": ["52.4"]
    },
    {
      "id": "n4",
      "ref": "36.3",
      "term": "柔弱勝剛強",
      "type": "互見",
      "text": "五個字是第 76、78 兩章的濃縮：那裡用人身草木與水反覆證明，第 40 章「弱者道之用」則是原則。此處插在四句排比與魚淵之喻中間，位置有些突兀，也因此常被單獨引用。",
      "see": ["76.3", "78.2", "40.1"]
    },
    {
      "id": "n5",
      "ref": "36.4",
      "term": "國之利器不可以示人",
      "type": "互見",
      "text": "利器一詞另見第 57 章「民多利器，國家滋昏」。此處或指權柄刑賞，或指足以制人的憑藉；重點在「不示人」——一旦亮出來，就像魚離了水。",
      "see": ["57.3"]
    },
    {
      "id": "n6",
      "ref": "36.4",
      "type": "義理",
      "text": "本章是全書最常被指為權謀的一章，韓非〈喻老〉即據此立說。要不要這樣讀，取決於 n1 那個「固」字。老子其他各章一貫反對算計（第 38 章斥「前識」為道之華），所以讀成規律描述與全書更合；但這一章確實留下了被當作術用的空間，這點不必迴避。",
      "see": ["38.7"]
    }
  ],
  "keywords": [
    { "term": "弱", "refs": ["36.1", "36.3"] },
    { "term": "強", "refs": ["36.1", "36.3"] }
  ],
  "meta": {
    "status": "draft",
    "base": "王弼本",
    "updated": "2026-09-14",
    "todo": ["白話待口述改寫（目前為起草稿）"]
  }
}
