{
  "chapter": 5,
  "part": "道經",
  "gist": "天地不仁，以萬物為芻狗；天地之間猶橐籥，虛而不屈",
  "text": "天地不仁，以萬物為芻狗；聖人不仁，以百姓為芻狗。天地之間，其猶橐籥乎？虛而不屈，動而愈出。多言數窮，不如守中。",
  "segments": [
    {
      "id": "5.1",
      "text": "天地不仁，以萬物為芻狗；聖人不仁，以百姓為芻狗。",
      "plain": "天地不講偏愛，把萬物當作芻狗；聖人不講偏愛，把百姓當作芻狗。"
    },
    {
      "id": "5.2",
      "text": "天地之間，其猶橐籥乎？虛而不屈，動而愈出。",
      "plain": "天地之間，不就像個風箱嗎？空著卻不會竭盡，一動就送出更多。"
    },
    {
      "id": "5.3",
      "text": "多言數窮，不如守中。",
      "plain": "話說多了很快就窮，不如守住那個虛。"
    }
  ],
  "plain": "天地不講偏愛，把萬物當作祭祀用的芻狗；聖人也不講偏愛，把百姓當作芻狗。天地之間，不就像個風箱嗎——裡頭是空的，卻怎麼也抽不乾，一鼓動就送出更多。話說多了反而很快就窮，不如守住中間那個虛。",
  "notes": [
    {
      "id": "n1",
      "ref": "5.1",
      "term": "不仁",
      "type": "義理",
      "text": "最容易被讀成冷酷的一句。「不仁」不是殘忍，是不偏愛——天地不對誰特別好，也就不對誰特別壞。老子把「仁」看成有對象的偏私，所以天地的公平恰恰表現為不仁。第 38 章把仁排在道與德之下，理由也在這裡。",
      "see": ["38.5"]
    },
    {
      "id": "n2",
      "ref": "5.1",
      "term": "芻狗",
      "type": "訓詁",
      "text": "芻狗是祭祀用草紮的狗，祭前珍重、祭後即棄。比喻的重點不在「被丟棄」，而在「該用時用、該過去時過去」——天地對萬物沒有恆久的偏好。"
    },
    {
      "id": "n3",
      "ref": "5.2",
      "term": "橐籥",
      "type": "訓詁",
      "text": "橐籥是風箱：橐是外面的皮囊，籥是送風的管。它之所以送得出風，正因為裡面是空的。屈訓竭、盡，「虛而不屈」是空著卻抽不乾。"
    },
    {
      "id": "n4",
      "ref": "5.2",
      "type": "互見",
      "text": "風箱是「虛而有用」的第三個比喻：第 4 章說「道沖，而用之或不盈」，第 11 章用車轂器皿說「無之以為用」，這裡用風箱說虛而不竭。三章都在證明同一件事——空的地方才是起作用的地方。",
      "see": ["4.1", "11.4"]
    },
    {
      "id": "n5",
      "ref": "5.3",
      "term": "多言數窮",
      "type": "訓詁",
      "text": "數在此讀 shuò，屢屢、很快。話多則理屈，與第 56 章「知者不言」、第 43 章「不言之教」是同一態度。",
      "see": ["56.1", "43.3"]
    },
    {
      "id": "n6",
      "ref": "5.3",
      "term": "守中",
      "type": "異讀",
      "text": "「中」有兩讀：一讀即「沖」，虛——承上句的風箱，守住那個空；一讀為中道、分寸。本站白話取前讀，因為緊接風箱之喻，語脈較順。"
    }
  ],
  "keywords": [
    { "term": "天地", "refs": ["5.1", "5.2"] },
    { "term": "萬物", "refs": ["5.1"] },
    { "term": "聖人", "refs": ["5.1"] }
  ],
  "meta": {
    "status": "draft",
    "base": "王弼本",
    "updated": "2026-09-14",
    "todo": ["白話待口述改寫（目前為起草稿）"]
  }
}
