{
  "chapter": 51,
  "part": "德經",
  "gist": "道生德畜，莫之命而常自然；生而不有，是謂玄德",
  "text": "道生之，德畜之，物形之，勢成之。是以萬物莫不尊道而貴德。道之尊，德之貴，夫莫之命而常自然。故道生之，德畜之；長之育之，亭之毒之，養之覆之。生而不有，為而不恃，長而不宰，是謂玄德。",
  "segments": [
    {
      "id": "51.1",
      "text": "道生之，德畜之，物形之，勢成之。",
      "plain": "道生出它，德養著它，物給了它形體，環境把它造成如今的樣子。"
    },
    {
      "id": "51.2",
      "text": "是以萬物莫不尊道而貴德。",
      "plain": "所以萬物沒有不尊崇道、不看重德的。"
    },
    {
      "id": "51.3",
      "text": "道之尊，德之貴，夫莫之命而常自然。",
      "plain": "道之所以尊、德之所以貴，是因為沒有誰下過命令，它向來就是這樣。"
    },
    {
      "id": "51.4",
      "text": "故道生之，德畜之；長之育之，亭之毒之，養之覆之。",
      "plain": "所以道生出它，德養著它：使它長大、使它成熟、使它安定、給它遮護。"
    },
    {
      "id": "51.5",
      "text": "生而不有，為而不恃，長而不宰，是謂玄德。",
      "plain": "生養了卻不佔有，做成了卻不自恃，做了頭卻不宰制——這叫作玄德。"
    }
  ],
  "plain": "道生出它，德養著它，物給了它形體，環境把它造成如今的樣子，所以萬物沒有不尊崇道、不看重德的。道之所以尊、德之所以貴，並不是誰封的、誰下令的，它向來就是這樣。道生出它，德養著它：使它長大、使它成熟、使它安定、給它遮護——做了這麼多，卻不佔有、不自恃、不宰制。這就叫玄德。",
  "notes": [
    {
      "id": "n1",
      "ref": "51.1",
      "term": "道生、德畜",
      "type": "義理",
      "text": "這是全書把「道」與「德」分工說得最清楚的一處：道負責生出，德負責養著。書名《道德經》的兩個字，關係就定在這一句上。"
    },
    {
      "id": "n2",
      "ref": "51.3",
      "term": "莫之命而常自然",
      "type": "訓詁",
      "text": "沒有誰下命令，它自己就是如此。「自然」在老子這裡不是山川草木，而是「自己這樣」——不假外力、不待封賞。道與德的尊貴沒有頒授者，這正是它與人間爵位的分別。"
    },
    {
      "id": "n3",
      "ref": "51.4",
      "term": "亭之毒之",
      "type": "訓詁",
      "text": "亭、毒二字歷來解說不一，多訓為安定與成熟（一說是「定」「熟」的借字）。六個動詞連用，講的是德如何一路把物養到底。"
    },
    {
      "id": "n4",
      "ref": "51.5",
      "type": "互見",
      "text": "「生而不有，為而不恃」與第 2 章末段原樣重出，那裡沒有給名字，這裡補上了：是謂玄德。兩章合看，第 2 章的聖人其實就是在學道的做法。",
      "see": ["2.4"]
    },
    {
      "id": "n5",
      "ref": "51.5",
      "term": "玄德",
      "type": "訓詁",
      "text": "玄是幽深、看不見。玄德不是特別高的德，是不顯露、不居功、因此看不出來的德——與第 56 章「玄同」同一個構詞。",
      "see": ["56.2"]
    }
  ],
  "keywords": [
    { "term": "道", "refs": ["51.1", "51.2", "51.3", "51.4"], "sense": "與德分工：道生、德畜" },
    { "term": "德", "refs": ["51.1", "51.2", "51.3", "51.4", "51.5"] },
    { "term": "萬物", "refs": ["51.2"] },
    { "term": "自然", "refs": ["51.3"] },
    { "term": "玄", "refs": ["51.5"] }
  ],
  "meta": {
    "status": "draft",
    "base": "王弼本",
    "updated": "2026-09-14",
    "todo": ["白話待口述改寫（目前為起草稿）"]
  }
}
