{
  "chapter": 73,
  "part": "德經",
  "gist": "勇於敢則殺，勇於不敢則活；天網恢恢，疏而不失",
  "text": "勇於敢則殺，勇於不敢則活。此兩者，或利或害。天之所惡，孰知其故？是以聖人猶難之。天之道，不爭而善勝，不言而善應，不召而自來，繟然而善謀。天網恢恢，疏而不失。",
  "segments": [
    {
      "id": "73.1",
      "text": "勇於敢則殺，勇於不敢則活。此兩者，或利或害。天之所惡，孰知其故？是以聖人猶難之。",
      "plain": "把勇氣用在敢上就送命，把勇氣用在不敢上就活下來。這兩樣，有的得利有的受害。天所厭惡的，誰知道是什麼緣故？所以聖人也覺得難。"
    },
    {
      "id": "73.2",
      "text": "天之道，不爭而善勝，不言而善應，不召而自來，繟然而善謀。",
      "plain": "天的道：不爭卻善於取勝，不說話卻善於回應，不召喚卻自己來到，寬緩從容卻善於籌劃。"
    },
    {
      "id": "73.3",
      "text": "天網恢恢，疏而不失。",
      "plain": "天的網又大又寬，網眼很疏，卻什麼也漏不掉。"
    }
  ],
  "plain": "把勇氣用在「敢」上就送命，把勇氣用在「不敢」上就活下來——這兩樣，有的得利、有的受害。天所厭惡的，誰說得出是什麼緣故？所以連聖人也覺得這事難。天的道是這樣的：不爭卻善於取勝，不說話卻善於回應，不召喚卻自己來到，寬緩從容卻善於籌劃。天的網又大又寬，網眼很疏，卻什麼也漏不掉。",
  "notes": [
    {
      "id": "n1",
      "ref": "73.1",
      "term": "勇於不敢",
      "type": "義理",
      "text": "全章最精采的一個詞。「不敢」在這裡不是膽小，而是需要勇氣才做得到的克制——敢動手往往比較容易，敢不動手才難。第 67 章的第三寶「不敢為天下先」用的是同一個「不敢」。",
      "see": ["67.2"]
    },
    {
      "id": "n2",
      "ref": "73.1",
      "term": "聖人猶難之",
      "type": "互見",
      "text": "這五個字與第 63 章末句完全相同。老子兩次用它：一次說做事，一次說判斷天意——連聖人都不敢說自己弄得清楚，這是全書少見的保留。",
      "see": ["63.6"]
    },
    {
      "id": "n3",
      "ref": "73.2",
      "term": "不爭而善勝",
      "type": "互見",
      "text": "「不爭」到這裡被歸給天：第 8 章說不爭則無尤，第 22、66 章說不爭則莫能與之爭，第 68 章稱它為德，這裡則說天本來就這樣做。",
      "see": ["8.4", "22.4", "68.2"]
    },
    {
      "id": "n4",
      "ref": "73.2",
      "term": "繟然",
      "type": "訓詁",
      "text": "繟是寬緩、舒展的樣子。「繟然而善謀」是不急不趕卻算得準——與人間那種處處算計的「謀」正好相反，也是第 38 章斥「前識」為道之華的另一面。",
      "see": ["38.7"]
    },
    {
      "id": "n5",
      "ref": "73.3",
      "term": "天網恢恢",
      "type": "義理",
      "text": "恢恢是寬廣。網眼疏卻漏不掉——這句常被引成「報應不爽」，但在本章脈絡裡它接的是上一段：天不爭、不言、不召、不急，看起來什麼都沒做，該來的卻一件也沒少。講的是不用力的有效，不是刑罰。"
    }
  ],
  "keywords": [
    { "term": "知", "refs": ["73.1"] },
    { "term": "聖人", "refs": ["73.1"] },
    { "term": "道", "refs": ["73.2"], "sense": "天之道" },
    { "term": "不爭", "refs": ["73.2"] },
    { "term": "善", "refs": ["73.2"] }
  ],
  "meta": {
    "status": "draft",
    "base": "王弼本",
    "updated": "2026-09-14",
    "todo": ["白話待口述改寫（目前為起草稿）"]
  }
}
