{
  "chapter": 1,
  "part": "道經",
  "gist": "道說不盡、名叫不全；從無與有兩頭看同一件事",
  "text": "道可道，非常道。名可名，非常名。無名天地之始，有名萬物之母。故常無欲，以觀其妙；常有欲，以觀其徼。此兩者，同出而異名，同謂之玄。玄之又玄，眾妙之門。",
  "segments": [
    {
      "id": "1.1",
      "text": "道可道，非常道。",
      "plain": "能說得出來的道，就不是那個恆常的道。"
    },
    {
      "id": "1.2",
      "text": "名可名，非常名。",
      "plain": "能叫得出名字的名，就不是那個恆常的名。"
    },
    {
      "id": "1.3",
      "text": "無名天地之始，有名萬物之母。",
      "plain": "天地初起時，還沒有名字可叫；萬物生出來了，名字才跟著來。",
      "alt": "另一種斷法：「無」是天地開端的稱呼，「有」是生養萬物者的稱呼。"
    },
    {
      "id": "1.4",
      "text": "故常無欲，以觀其妙；",
      "plain": "所以常保持無所求的狀態，好看見它幽微難見的那一面；"
    },
    {
      "id": "1.5",
      "text": "常有欲，以觀其徼。",
      "plain": "常帶著要求去看，看見的就是它顯出來的邊界與端倪。"
    },
    {
      "id": "1.6",
      "text": "此兩者，同出而異名，同謂之玄。",
      "plain": "這兩頭出自同一個源頭，只是名字不同，都可以叫它「玄」。"
    },
    {
      "id": "1.7",
      "text": "玄之又玄，眾妙之門。",
      "plain": "幽深之中還有幽深——一切奧妙都從這道門出來。"
    }
  ],
  "plain": "講得出口的道，就已經不是那個恆常的道了；叫得出口的名，也不是那個恆常的名。天地剛開始時無可名狀，有了名字，萬物才一一分別出來。所以人要常保無所求，才看得見它幽微的那一面；一旦帶著求取去看，看見的就只是它顯露出來的邊界。無與有這兩頭其實同源，只是名字不同，都可以叫作「玄」。幽深之上還有幽深，一切奧妙都由此出入。",
  "notes": [
    {
      "id": "n1",
      "ref": "1.1",
      "term": "道",
      "type": "訓詁",
      "text": "一句三個「道」字，意思不同：第一、三個是名詞，指道體；中間的「可道」是動詞，指言說、指陳。全句是說：一旦落入言說，就被限定，不再是那個不受限定的道。",
      "source": "王弼注"
    },
    {
      "id": "n2",
      "ref": "1.1",
      "term": "常",
      "type": "異文",
      "text": "帛書甲、乙本作「恆」：「道可道也，非恆道也。」今本作「常」，一般認為是漢代避文帝劉恆名諱所改。讀「恆」語氣更重，強調不變。",
      "source": "帛書本"
    },
    {
      "id": "n3",
      "ref": "1.3",
      "term": "無名／有名",
      "type": "異讀",
      "text": "兩種斷句自古並行。舊讀作「無名，天地之始；有名，萬物之母」，以「無名／有名」為主詞；宋人王安石、司馬光改讀為「無，名天地之始；有，名萬物之母」，把「無」「有」獨立成概念，與下文「常無」「常有」相呼應。本站正文採舊讀，另一讀存於 alt。"
    },
    {
      "id": "n4",
      "ref": "1.3",
      "type": "異文",
      "text": "帛書本兩句皆作「萬物」——「無名萬物之始也，有名萬物之母也」，沒有「天地」。今本前句作「天地」，使兩句形成天地／萬物的層次差。",
      "source": "帛書本"
    },
    {
      "id": "n5",
      "ref": "1.4",
      "term": "妙",
      "type": "訓詁",
      "text": "幽微到極處、幾乎看不見的狀態。王弼注：「妙者，微之極也。」不是今語「巧妙」的意思。",
      "source": "王弼注"
    },
    {
      "id": "n6",
      "ref": "1.4",
      "type": "異讀",
      "text": "此句亦可斷為「故常無，欲以觀其妙；常有，欲以觀其徼」。取哪一讀，與 n3 的斷句連動：讀「無／有」為概念者，多半兩處一起改。"
    },
    {
      "id": "n7",
      "ref": "1.5",
      "term": "徼",
      "type": "訓詁",
      "text": "音 jiào。王弼注「徼，歸終也」，指事物運行到底、顯出來的界限；另一說通「竅」，指端倪、可見的孔隙。兩說都指向「有形可見的那一端」，與「妙」相對。",
      "source": "王弼注"
    },
    {
      "id": "n8",
      "ref": "1.6",
      "type": "異文",
      "text": "帛書本作「兩者同出，異名同謂」，重點在「名雖不同，所指是一」；今本作「此兩者同出而異名，同謂之玄」，把「玄」明著點出來當結論。",
      "source": "帛書本"
    },
    {
      "id": "n9",
      "ref": "1.6",
      "term": "玄",
      "type": "訓詁",
      "text": "本義是黑中帶赤的顏色，引申為幽深、看不透。王弼注：「玄者，冥也，默然無有也。」此處不是神祕，而是「深到看不到底」。",
      "source": "王弼注"
    },
    {
      "id": "n10",
      "ref": "1.7",
      "term": "眾妙之門",
      "type": "互見",
      "text": "「門」的意象與第 6 章「玄牝之門，是謂天地根」同調；「無」「有」同出的說法，可與第 40 章「天下萬物生於有，有生於無」對讀。",
      "see": ["6.3", "40.2"]
    }
  ],
  "keywords": [
    { "term": "道", "refs": ["1.1"], "sense": "兼指道體與言說，見 n1" },
    { "term": "名", "refs": ["1.2", "1.3"] },
    { "term": "常", "refs": ["1.1", "1.2", "1.4", "1.5"] },
    { "term": "無", "refs": ["1.3", "1.4"] },
    { "term": "有", "refs": ["1.3", "1.5"] },
    { "term": "妙", "refs": ["1.4", "1.7"] },
    { "term": "玄", "refs": ["1.6", "1.7"] }
  ],
  "meta": {
    "status": "draft",
    "base": "王弼本",
    "updated": "2026-09-14",
    "todo": [
      "白話待口述改寫（目前為起草稿）",
      "n10 的 see 錨點 6.3、40.2 待第 6、40 章建好後校正"
    ]
  }
}
