{
  "chapter": 4,
  "part": "道經",
  "gist": "道是虛的，所以用不完；在天帝之先",
  "text": "道沖，而用之或不盈。淵兮似萬物之宗。挫其銳，解其紛，和其光，同其塵。湛兮似或存。吾不知誰之子，象帝之先。",
  "segments": [
    {
      "id": "4.1",
      "text": "道沖，而用之或不盈。",
      "plain": "道是虛的，可是怎麼用都填不滿、用不完。"
    },
    {
      "id": "4.2",
      "text": "淵兮似萬物之宗。",
      "plain": "深得看不到底，像是萬物的源頭。"
    },
    {
      "id": "4.3",
      "text": "挫其銳，解其紛，和其光，同其塵。",
      "plain": "磨掉鋒芒，解開糾結，調和光芒，混同塵土。"
    },
    {
      "id": "4.4",
      "text": "湛兮似或存。",
      "plain": "沉靜得幾乎看不出來，卻又像是一直都在。"
    },
    {
      "id": "4.5",
      "text": "吾不知誰之子，象帝之先。",
      "plain": "我不知道它是誰生的，只覺得它比天帝還早。"
    }
  ],
  "plain": "道是虛的，可是怎麼用都填不滿。它深得看不到底，像是萬物的源頭。它磨掉鋒芒、解開糾結、調和光芒、混同塵土——不突出自己，跟萬物處在一起。沉靜得幾乎看不出來，卻又像是一直都在。我不知道它是誰生的，只覺得它比天帝還早。",
  "notes": [
    {
      "id": "n1",
      "ref": "4.1",
      "term": "沖",
      "type": "訓詁",
      "text": "沖通「盅」，虛。《說文》釋「盅」為器虛，並直接引老子作「道盅而用之」，可見古本此字本作「盅」。整章的立論就架在這個「虛」字上：正因為是空的，才填不滿、用不完。",
      "source": "說文"
    },
    {
      "id": "n2",
      "ref": "4.1",
      "term": "沖",
      "type": "互見",
      "text": "同一個字見於第 42 章「沖氣以為和」——那裡是虛而能調和，這裡是虛而用不盡，合看才完整。",
      "see": ["42.2"]
    },
    {
      "id": "n3",
      "ref": "4.1",
      "term": "或",
      "type": "訓詁",
      "text": "「或」在此是語助，不必實講成「或許」。「用之或不盈」就是用它而不會滿。"
    },
    {
      "id": "n4",
      "ref": "4.3",
      "type": "互見",
      "text": "這四句又原封不動見於第 56 章。銳、紛、光、塵四者，前兩者是自身的鋒芒與糾纏，後兩者是與外物的關係——合起來就是不讓自己顯眼。此處說的是道的樣子，第 56 章則轉成人的修為。",
      "see": ["56.2"]
    },
    {
      "id": "n5",
      "ref": "4.5",
      "term": "象帝之先",
      "type": "訓詁",
      "text": "象是似，帝指天帝。道似乎在天帝之前就有了——這句把道推到一切人格神之上，是老子最少見的直接表態。"
    }
  ],
  "keywords": [
    { "term": "道", "refs": ["4.1"], "sense": "以虛為體" },
    { "term": "萬物", "refs": ["4.2"] },
    { "term": "和", "refs": ["4.3"] }
  ],
  "meta": {
    "status": "draft",
    "base": "王弼本",
    "updated": "2026-09-14",
    "todo": ["白話待口述改寫（目前為起草稿）"]
  }
}
