{
  "chapter": 52,
  "part": "德經",
  "gist": "得母以知子，守母不殆；塞兌閉門，見小曰明，守柔曰強",
  "text": "天下有始，以為天下母。既得其母，以知其子；既知其子，復守其母，沒身不殆。塞其兌，閉其門，終身不勤；開其兌，濟其事，終身不救。見小曰明，守柔曰強。用其光，復歸其明，無遺身殃，是為襲常。",
  "segments": [
    {
      "id": "52.1",
      "text": "天下有始，以為天下母。",
      "plain": "天下有個開端，可以當作天下的母親。"
    },
    {
      "id": "52.2",
      "text": "既得其母，以知其子；既知其子，復守其母，沒身不殆。",
      "plain": "得到了母親，就認得出兒子；認得了兒子，再回頭守住母親，終身不會出事。"
    },
    {
      "id": "52.3",
      "text": "塞其兌，閉其門，終身不勤；開其兌，濟其事，終身不救。",
      "plain": "塞住孔竅、關上門，終身不會疲累；打開孔竅、去多辦事情，終身沒得救。"
    },
    {
      "id": "52.4",
      "text": "見小曰明，守柔曰強。",
      "plain": "看得見細微叫作明，守得住柔軟叫作強。"
    },
    {
      "id": "52.5",
      "text": "用其光，復歸其明，無遺身殃，是為襲常。",
      "plain": "用它的光，再回到那個明，不給自己留下災殃——這就叫承襲常道。"
    }
  ],
  "plain": "天下有個開端，可以當作天下的母親。得到了母親，就認得出她的兒子；認得了兒子，再回頭守住母親，終身不會出事。塞住孔竅、關上門，終身不會疲累；反過來打開孔竅、一天到晚多辦事情，那就終身沒得救了。看得見細微叫作明，守得住柔軟叫作強。用它的光照出去，再回到那個明本身，不給自己留下災殃——這就叫承襲常道。",
  "notes": [
    {
      "id": "n1",
      "ref": "52.1",
      "term": "天下母",
      "type": "互見",
      "text": "「母」這個意象貫穿全書：第 1 章「有名萬物之母」，第 25 章「可以為天下母」，這裡再用一次。取的都是「生出來並且還在那裡」——不是生完就走的源頭。",
      "see": ["1.3", "25.2"]
    },
    {
      "id": "n2",
      "ref": "52.2",
      "term": "母、子",
      "type": "義理",
      "text": "母是道，子是萬物。老子的認識次序是倒過來的：不是從萬物歸納出道，而是先握住母才認得出子；認得子之後還要回頭守住母，否則就在末端打轉。「復守其母」四個字是全章的關鍵。"
    },
    {
      "id": "n3",
      "ref": "52.3",
      "term": "塞其兌，閉其門",
      "type": "互見",
      "text": "與第 56 章原樣重出。兌是孔竅，門是出入口，指向外追逐的通道。那裡接的是「挫其銳，解其紛」，這裡接的是「終身不勤」——一個講修為的動作，一個講後果。",
      "see": ["56.2"]
    },
    {
      "id": "n4",
      "ref": "52.3",
      "term": "勤",
      "type": "互見",
      "text": "勤訓盡、訓勞。「終身不勤」與第 6 章「用之不勤」同一個字義：用不完、累不著。",
      "see": ["6.3"]
    },
    {
      "id": "n5",
      "ref": "52.4",
      "term": "見小曰明",
      "type": "互見",
      "text": "「明」在老子這裡一律指向內、向細處看：第 33 章「自知者明」看自己，第 16 章「知常曰明」看規律，這裡看細微。三處都不是對外炫示的才智。",
      "see": ["33.1", "16.4"]
    },
    {
      "id": "n6",
      "ref": "52.4",
      "term": "守柔曰強",
      "type": "互見",
      "text": "又一個褒義的「強」，與第 33 章「自勝者強」同類，和第 76 章「堅強者死之徒」的貶義正好相反。同一個字在老子筆下兩邊都用，分野在於對外逞強還是對自己下手。",
      "see": ["33.2", "76.3"]
    }
  ],
  "keywords": [
    { "term": "天下", "refs": ["52.1"] },
    { "term": "母", "refs": ["52.1", "52.2"] },
    { "term": "有", "refs": ["52.1"] },
    { "term": "知", "refs": ["52.2"] },
    { "term": "強", "refs": ["52.4"], "sense": "此處是褒義的守柔，與 76 章貶義相反" },
    { "term": "常", "refs": ["52.5"] }
  ],
  "meta": {
    "status": "draft",
    "base": "王弼本",
    "updated": "2026-09-14",
    "todo": ["白話待口述改寫（目前為起草稿）"]
  }
}
