{
  "chapter": 38,
  "part": "德經",
  "gist": "德經首章：上德不德；失道而後德，失德而後仁義禮",
  "text": "上德不德，是以有德；下德不失德，是以無德。上德無為而無以為；下德為之而有以為。上仁為之而無以為；上義為之而有以為。上禮為之而莫之應，則攘臂而扔之。故失道而後德，失德而後仁，失仁而後義，失義而後禮。夫禮者，忠信之薄，而亂之首。前識者，道之華，而愚之始。是以大丈夫處其厚，不居其薄；處其實，不居其華。故去彼取此。",
  "segments": [
    {
      "id": "38.1",
      "text": "上德不德，是以有德；下德不失德，是以無德。",
      "plain": "上德的人不把德當回事，所以真有德；下德的人生怕丟了德，所以反而沒德。"
    },
    {
      "id": "38.2",
      "text": "上德無為而無以為；下德為之而有以為。",
      "plain": "上德不刻意作為，也沒有存心；下德做了事，而且是存心去做的。"
    },
    {
      "id": "38.3",
      "text": "上仁為之而無以為；上義為之而有以為。",
      "plain": "上仁做了事而沒有存心；上義做了事而且是存心去做的。"
    },
    {
      "id": "38.4",
      "text": "上禮為之而莫之應，則攘臂而扔之。",
      "plain": "上禮做了事卻沒人響應，就捲起袖子把人拽過來。"
    },
    {
      "id": "38.5",
      "text": "故失道而後德，失德而後仁，失仁而後義，失義而後禮。",
      "plain": "所以失了道才講德，失了德才講仁，失了仁才講義，失了義才講禮。"
    },
    {
      "id": "38.6",
      "text": "夫禮者，忠信之薄，而亂之首。",
      "plain": "禮這個東西，是忠信淡薄的產物，也是禍亂的開頭。"
    },
    {
      "id": "38.7",
      "text": "前識者，道之華，而愚之始。",
      "plain": "事事預先算計的，是道的虛花，也是愚昧的開端。"
    },
    {
      "id": "38.8",
      "text": "是以大丈夫處其厚，不居其薄；處其實，不居其華。故去彼取此。",
      "plain": "所以大丈夫守在厚實那邊，不待在淡薄那邊；守在實在那邊，不待在虛花那邊。捨那個，取這個。"
    }
  ],
  "plain": "上德的人不把德當回事，所以才真有德；下德的人生怕丟了德，反而沒有德。上德不刻意作為，也沒有存心；下德做了事，而且是存心去做的。往下數：上仁做了事而沒有存心，上義做了事而且存心，上禮做了事卻沒人理，就捲起袖子把人拽過來。所以失了道才講德，失了德才講仁，失了仁才講義，失了義才講禮——禮是忠信淡薄的產物，也是禍亂的開頭。至於事事預先算計的聰明，那是道開出來的虛花，也是愚昧的開端。所以大丈夫守在厚實與實在那一邊，不待在淡薄與虛花那一邊：捨那個，取這個。",
  "notes": [
    {
      "id": "n1",
      "ref": "38.1",
      "term": "上德不德",
      "type": "訓詁",
      "text": "第二個「德」是動詞：把德當成一回事、掛在心上。上德之人不覺得自己在行德，所以德是真的；下德之人時時守著怕失去，那個德已經變成要保住的東西。"
    },
    {
      "id": "n2",
      "ref": "38.2",
      "term": "無以為",
      "type": "訓詁",
      "text": "「以為」是存心、有用意。無為說的是行動，無以為說的是動機——兩層都空了，才是上德。老子在這裡把「無為」拆得比別處都細。"
    },
    {
      "id": "n3",
      "ref": "38.2",
      "type": "異文",
      "text": "帛書本此章沒有「下德為之而有以為」一句，直接從上德接到上仁。若從帛書，全章只有一條下滑的線（德—仁—義—禮），今本則多出上下德的對照。此條待覆核簡帛釋文後定稿。",
      "source": "帛書本"
    },
    {
      "id": "n4",
      "ref": "38.5",
      "type": "義理",
      "text": "這四句是德經的開篇總綱，也是老子對儒家德目最正面的一次交代：仁、義、禮不是壞東西，而是道失落之後一級一級的補救——每補一級，離本來的狀態就更遠一點。"
    },
    {
      "id": "n5",
      "ref": "38.5",
      "term": "道、德",
      "type": "互見",
      "text": "道與德的關係，第 51 章說得最清楚：「道生之，德畜之。」那裡講兩者的分工，這裡講兩者的高下——合看才知道德不是道的替代品，是道落到具體事物上的那一層。",
      "see": ["51.1"]
    },
    {
      "id": "n6",
      "ref": "38.7",
      "term": "前識",
      "type": "訓詁",
      "text": "前識是事先識見、預作判斷。老子不反對看得遠，反對的是把預測當成依據去安排一切——第 64 章「為之於未有」講的是趁早，不是預先算計，兩者要分清楚。",
      "see": ["64.2"]
    },
    {
      "id": "n7",
      "ref": "38.8",
      "type": "義理",
      "text": "本章是德經（38–81 章）的首章。帛書本德經在前、道經在後，若照那個次序，開卷第一句就是「上德不德」——全書從「不把德當回事」起頭，與今本從「道可道」起頭，氣味相當不同。"
    }
  ],
  "keywords": [
    { "term": "德", "refs": ["38.1", "38.2", "38.5"] },
    { "term": "無為", "refs": ["38.2"] },
    { "term": "道", "refs": ["38.5", "38.7"], "sense": "作為仁義禮之上的本源" },
    { "term": "信", "refs": ["38.6"] }
  ],
  "meta": {
    "status": "draft",
    "base": "王弼本",
    "updated": "2026-09-14",
    "todo": [
      "白話待口述改寫（目前為起草稿）",
      "n3 帛書無「下德」句一事待覆核簡帛釋文"
    ]
  }
}
