{
  "chapter": 46,
  "part": "德經",
  "gist": "天下有道卻走馬以糞；禍莫大於不知足，知足之足常足",
  "text": "天下有道，卻走馬以糞；天下無道，戎馬生於郊。禍莫大於不知足，咎莫大於欲得。故知足之足，常足矣。",
  "segments": [
    {
      "id": "46.1",
      "text": "天下有道，卻走馬以糞；天下無道，戎馬生於郊。",
      "plain": "天下有道的時候，把戰馬退回去耕田施肥；天下無道的時候，連懷孕的母馬都得在戰場邊的郊野產駒。"
    },
    {
      "id": "46.2",
      "text": "禍莫大於不知足，咎莫大於欲得。",
      "plain": "災禍沒有比不知足更大的，罪過沒有比貪得更大的。"
    },
    {
      "id": "46.3",
      "text": "故知足之足，常足矣。",
      "plain": "所以由「知道夠了」得來的滿足，才是長久的滿足。"
    }
  ],
  "plain": "天下有道的時候，戰馬退回田裡去耕地施肥；天下無道的時候，連懷孕的母馬都得在戰場邊的郊野產駒。災禍沒有比不知足更大的，罪過沒有比貪得更大的——所以由「知道夠了」得來的滿足，才是長久的滿足。",
  "notes": [
    {
      "id": "n1",
      "ref": "46.1",
      "term": "卻走馬以糞",
      "type": "訓詁",
      "text": "卻是退回，走馬是善跑的好馬（戰馬），糞在此作動詞，指施肥耕作。天下太平時，好馬的用處是下田——這個畫面本身就是全章的論點。"
    },
    {
      "id": "n2",
      "ref": "46.1",
      "term": "戎馬生於郊",
      "type": "義理",
      "text": "戰事久了，連懷孕的母馬都被徵去，只能在郊野生產。老子不直接罵戰爭，只把兩種馬的境遇並排放著——與第 57 章「法令滋彰，盜賊多有」同一種論證方式：不推理，只讓現象自己說話。",
      "see": ["57.3"]
    },
    {
      "id": "n3",
      "ref": "46.2",
      "term": "咎",
      "type": "互見",
      "text": "咎是禍患、罪過。第 9 章「富貴而驕，自遺其咎」說的是同一件事的個人版：禍不是外面來的，是貪得替自己招來的。",
      "see": ["9.3"]
    },
    {
      "id": "n4",
      "ref": "46.3",
      "term": "知足",
      "type": "互見",
      "text": "第 33 章「知足者富」把富從擁有多少改寫成知道何時停，這裡再推一層：唯有從「知道夠了」來的滿足才是常足——靠得到更多來填的滿足，本質上填不滿。",
      "see": ["33.3"]
    }
  ],
  "keywords": [
    { "term": "天下", "refs": ["46.1"] },
    { "term": "道", "refs": ["46.1"], "sense": "以天下有道無道對舉" },
    { "term": "知", "refs": ["46.2", "46.3"] },
    { "term": "常", "refs": ["46.3"] }
  ],
  "meta": {
    "status": "draft",
    "base": "王弼本",
    "updated": "2026-09-14",
    "todo": ["白話待口述改寫（目前為起草稿）"]
  }
}
