{
  "chapter": 69,
  "part": "德經",
  "gist": "不敢為主而為客；禍莫大於輕敵；抗兵相加，哀者勝矣",
  "text": "用兵有言：吾不敢為主，而為客；不敢進寸，而退尺。是謂行無行，攘無臂，扔無敵，執無兵。禍莫大於輕敵，輕敵幾喪吾寶。故抗兵相加，哀者勝矣。",
  "segments": [
    {
      "id": "69.1",
      "text": "用兵有言：吾不敢為主，而為客；不敢進寸，而退尺。",
      "plain": "用兵的人有這樣的話：我不敢當主動的一方，寧可當被動的一方；不敢往前進一寸，寧可往後退一尺。"
    },
    {
      "id": "69.2",
      "text": "是謂行無行，攘無臂，扔無敵，執無兵。",
      "plain": "這叫作：行軍卻沒有陣勢，捋袖卻沒有手臂，迎戰卻沒有敵人，手上卻沒有兵器。"
    },
    {
      "id": "69.3",
      "text": "禍莫大於輕敵，輕敵幾喪吾寶。",
      "plain": "災禍沒有比輕敵更大的，輕敵幾乎就要丟掉我的寶。"
    },
    {
      "id": "69.4",
      "text": "故抗兵相加，哀者勝矣。",
      "plain": "所以兩軍實力相當而對上，心裡悲哀的那一方會贏。"
    }
  ],
  "plain": "用兵的人有這樣的話：我不敢當主動的一方，寧可當被動的一方；不敢往前進一寸，寧可往後退一尺。這叫作行軍卻沒有陣勢，捋袖卻沒有手臂，迎戰卻沒有敵人，手上卻沒有兵器。災禍沒有比輕敵更大的，輕敵幾乎就要丟掉我的寶。所以兩軍實力相當而對上，心裡悲哀的那一方會贏。",
  "notes": [
    {
      "id": "n1",
      "ref": "69.1",
      "term": "用兵有言",
      "type": "互見",
      "text": "又一次明說自己在引現成的話——與第 41 章「建言有之」、第 22 章「古之所謂」、第 42 章「人之所教」、第 57 章「故聖人云」同一個動作。老子談兵的幾句名言，多半是兵家舊語。",
      "see": ["41.2", "22.5"]
    },
    {
      "id": "n2",
      "ref": "69.1",
      "term": "為客",
      "type": "訓詁",
      "text": "主是主動挑起的一方，客是被動應戰的一方。不為主而為客、不進而退，是把「不得已而用之」落實成具體的戰場姿態。",
      "see": ["31.2"]
    },
    {
      "id": "n3",
      "ref": "69.2",
      "type": "義理",
      "text": "四個「無」不是玄語：行軍不擺陣勢、捋袖看不見臂膀、迎戰而前面沒有敵人、動手而手上沒有兵器——講的是不擺出攻擊的架式，讓對方找不到可以對上的東西。與第 50 章「以其無死地」同一個思路：不是無敵，是沒有可以對上的那個面。",
      "see": ["50.4"]
    },
    {
      "id": "n4",
      "ref": "69.3",
      "term": "吾寶",
      "type": "互見",
      "text": "「寶」指第 67 章的三寶——慈、儉、不敢為天下先。輕敵首先丟掉的就是「慈」：一旦看輕對手，就不再把對面當人，於是什麼都做得出來。",
      "see": ["67.2"]
    },
    {
      "id": "n5",
      "ref": "69.4",
      "term": "哀者勝矣",
      "type": "互見",
      "text": "全章的落點，也是老子談兵三章的共同結論：第 31 章「殺人之眾，以悲哀泣之」，第 67 章「夫慈以戰則勝」，這裡說「哀者勝」。能打的力量來自捨不得，不是來自狠——這一點他說了三次。",
      "see": ["31.5", "67.5"]
    }
  ],
  "keywords": [
    { "term": "無", "refs": ["69.2"] }
  ],
  "meta": {
    "status": "draft",
    "base": "王弼本",
    "updated": "2026-09-14",
    "todo": ["白話待口述改寫（目前為起草稿）"]
  }
}
