{
  "chapter": 47,
  "part": "德經",
  "gist": "不出戶知天下；其出彌遠，其知彌少；不行而知，不為而成",
  "text": "不出戶，知天下；不闚牖，見天道。其出彌遠，其知彌少。是以聖人不行而知，不見而名，不為而成。",
  "segments": [
    {
      "id": "47.1",
      "text": "不出戶，知天下；不闚牖，見天道。",
      "plain": "不出門，也知道天下；不從窗口張望，也看得見天道。"
    },
    {
      "id": "47.2",
      "text": "其出彌遠，其知彌少。",
      "plain": "跑得愈遠，知道的反而愈少。"
    },
    {
      "id": "47.3",
      "text": "是以聖人不行而知，不見而名，不為而成。",
      "plain": "所以聖人不必走過就知道，不必看見就說得出，不必動手就成了。"
    }
  ],
  "plain": "不出門，也知道天下；不從窗口張望，也看得見天道。跑得愈遠，知道的反而愈少。所以聖人不必走過就知道，不必看見就說得出，不必動手就成了。",
  "notes": [
    {
      "id": "n1",
      "ref": "47.1",
      "term": "闚牖",
      "type": "訓詁",
      "text": "闚同「窺」，牖是窗。出戶與闚牖都是向外找答案的動作；老子說這兩件事都不必做，因為他要找的東西不在外面的某個地點上。"
    },
    {
      "id": "n2",
      "ref": "47.2",
      "type": "義理",
      "text": "全章最容易被誤讀的一句，讀成反對見聞、閉門造車的不少。老子的論點有個前提：他要知道的是「天道」那種貫穿一切的規律，那東西每一處都在，所以不必跑遠；跑得愈遠反而愈被枝節牽著走。但話說回來，這句確實與經驗探求的態度相悖——它成立與否，取決於你要知道的是規律還是事實，這一點不必替他打圓場。"
    },
    {
      "id": "n3",
      "ref": "47.2",
      "term": "其知彌少",
      "type": "互見",
      "text": "與第 48 章「為學日益，為道日損」是同一個判斷：往外累積與往內求道的方向相反。第 81 章「知者不博，博者不知」說得更直接。",
      "see": ["48.1", "81.3"]
    },
    {
      "id": "n4",
      "ref": "47.3",
      "term": "不見而名",
      "type": "異讀",
      "text": "「名」一讀為命名、說得出（不必親見就叫得出它是什麼），一讀通「明」，即看得明白。兩讀差別不大，本站白話取前者。"
    },
    {
      "id": "n5",
      "ref": "47.3",
      "term": "不為而成",
      "type": "互見",
      "text": "「不為而成」就是第 48 章「無為而無不為」、第 37 章「道常無為而無不為」的縮寫。三句話是同一件事的三種長度。",
      "see": ["48.3", "37.1"]
    }
  ],
  "keywords": [
    { "term": "知", "refs": ["47.1", "47.2", "47.3"] },
    { "term": "天下", "refs": ["47.1"] },
    { "term": "道", "refs": ["47.1"], "sense": "天道" },
    { "term": "聖人", "refs": ["47.3"] },
    { "term": "名", "refs": ["47.3"] }
  ],
  "meta": {
    "status": "draft",
    "base": "王弼本",
    "updated": "2026-09-14",
    "todo": ["白話待口述改寫（目前為起草稿）"]
  }
}
