{
  "chapter": 71,
  "part": "德經",
  "gist": "知不知，上；夫唯病病，是以不病",
  "text": "知不知，上；不知知，病。夫唯病病，是以不病。聖人不病，以其病病，是以不病。",
  "segments": [
    {
      "id": "71.1",
      "text": "知不知，上；不知知，病。",
      "plain": "知道自己有所不知，是上等；不知道卻自以為知道，就是毛病。"
    },
    {
      "id": "71.2",
      "text": "夫唯病病，是以不病。",
      "plain": "正因為把毛病當毛病看，所以才沒毛病。"
    },
    {
      "id": "71.3",
      "text": "聖人不病，以其病病，是以不病。",
      "plain": "聖人沒有毛病，是因為他把毛病當毛病看，所以才沒毛病。"
    }
  ],
  "plain": "知道自己有所不知，是上等；不知道卻自以為知道，那就是毛病。正因為把毛病當毛病看，所以才沒毛病。聖人之所以沒毛病，就是因為他把毛病當毛病看——所以才沒毛病。",
  "notes": [
    {
      "id": "n1",
      "ref": "71.1",
      "term": "知不知",
      "type": "異讀",
      "text": "兩讀：一是「知道自己有所不知」（承認無知），一是「知道了卻當作不知道」（有知而不恃）。前一讀與下句「不知知」正好對稱，本站白話取之；後一讀則與第 65 章「非以明民」那條線相通。"
    },
    {
      "id": "n2",
      "ref": "71.1",
      "type": "互見",
      "text": "「知」這條線在老子這裡一律向內：第 33 章「自知者明」看自己，第 56 章「知者不言」管住嘴，這裡管住的是「以為自己知道」的那個念頭。",
      "see": ["33.1", "56.1"]
    },
    {
      "id": "n3",
      "ref": "71.2",
      "term": "病病",
      "type": "訓詁",
      "text": "前一個「病」是動詞：把它當成毛病、拿它當回事。全章短短二十餘字，靠這個構詞轉了一圈——毛病不在有毛病，在不覺得那是毛病。"
    },
    {
      "id": "n4",
      "ref": "71.3",
      "type": "義理",
      "text": "第 63 章「聖人猶難之，故終無難矣」是完全一樣的結構：把難的當難的，就沒有難事；把毛病當毛病，就沒有毛病。老子這類句子看似繞口令，實際說的是一件很實在的事——態度先對，結果才對。",
      "see": ["63.6"]
    }
  ],
  "keywords": [
    { "term": "知", "refs": ["71.1"] },
    { "term": "聖人", "refs": ["71.3"] }
  ],
  "meta": {
    "status": "draft",
    "base": "王弼本",
    "updated": "2026-09-14",
    "todo": ["白話待口述改寫（目前為起草稿）"]
  }
}
