{
  "chapter": 2,
  "part": "道經",
  "gist": "美惡善否相對而生；聖人處無為之事，功成而不居",
  "text": "天下皆知美之為美，斯惡已；皆知善之為善，斯不善已。故有無相生，難易相成，長短相較，高下相傾，音聲相和，前後相隨。是以聖人處無為之事，行不言之教。萬物作焉而不辭，生而不有，為而不恃，功成而弗居。夫唯弗居，是以不去。",
  "segments": [
    {
      "id": "2.1",
      "text": "天下皆知美之為美，斯惡已；皆知善之為善，斯不善已。",
      "plain": "天下都曉得美之所以為美，醜的觀念就跟著出來了；都曉得善之所以為善，不善也就跟著出來了。"
    },
    {
      "id": "2.2",
      "text": "故有無相生，難易相成，長短相較，高下相傾，音聲相和，前後相隨。",
      "plain": "所以有和無互相生出，難和易互相造成，長和短互相比出來，高和下互相襯出來，音和聲互相和出來，前和後互相跟著來。"
    },
    {
      "id": "2.3",
      "text": "是以聖人處無為之事，行不言之教。",
      "plain": "所以聖人做事不妄加作為，施教不靠言語。"
    },
    {
      "id": "2.4",
      "text": "萬物作焉而不辭，生而不有，為而不恃，功成而弗居。",
      "plain": "萬物自己興起而他不推辭，生養了卻不佔有，做成了卻不自恃，功成了卻不居功。"
    },
    {
      "id": "2.5",
      "text": "夫唯弗居，是以不去。",
      "plain": "正因為不居功，功勞才不會離他而去。"
    }
  ],
  "plain": "天下都曉得美之所以為美，醜的觀念就跟著出來了；都曉得善之所以為善，不善也就跟著出來了。有與無互相生出，難與易互相造成，長短互相比出來，高下互相襯出來，音聲互相和出來，前後互相跟著來——這些成對的概念沒有一個能單獨站著。所以聖人做事不妄加作為，施教不靠言語：萬物自己興起而他不推辭，生養了卻不佔有，做成了卻不自恃，功成了卻不居功。正因為他不居功，功勞才不會離他而去。",
  "notes": [
    {
      "id": "n1",
      "ref": "2.1",
      "type": "義理",
      "text": "這兩句常被讀成「別分辨美醜善惡」，但老子說的是更前一步的事：一旦「美」被立為標準，「醜」同時就被造出來了。他針對的不是美醜本身，是立標準這個動作。"
    },
    {
      "id": "n2",
      "ref": "2.2",
      "term": "有無相生",
      "type": "互見",
      "text": "有與無的關係，全書出現三種說法：此處是相生（互相生出），第 1 章是同出而異名，第 40 章是有生於無。三處併看才知道老子不是前後矛盾——同源、對生、有次第，講的是同一組關係的三個面向。",
      "see": ["1.6", "40.2"]
    },
    {
      "id": "n3",
      "ref": "2.2",
      "term": "相較",
      "type": "異文",
      "text": "王弼本作「相較」，他本多作「相形」。較是比較，形是顯形，義相近；六句一律是「甲乙互為對方的條件」，取哪個字都不影響句意。"
    },
    {
      "id": "n4",
      "ref": "2.3",
      "term": "無為",
      "type": "互見",
      "text": "「無為」在此第一次出現，第 48 章把它推成方法（損之又損，以至於無為），第 57 章則是它的政治版。此處只說聖人這樣做事，還沒展開。",
      "see": ["48.2", "57.4"]
    },
    {
      "id": "n5",
      "ref": "2.4",
      "term": "不辭",
      "type": "訓詁",
      "text": "辭是推辭、拒絕。「作焉而不辭」是萬物自己興作而他不去攔、不去管——不是他做了什麼，是他不做什麼。"
    },
    {
      "id": "n6",
      "ref": "2.4",
      "type": "義理",
      "text": "「生而不有，為而不恃，功成而弗居」三句在第 51 章又原樣出現一次，那裡冠以「玄德」之名。老子重出的句子通常是他認定的定式，不是編輯疏漏。"
    },
    {
      "id": "n7",
      "ref": "2.5",
      "type": "互見",
      "text": "「夫唯…是以…」是老子的招牌句型：不居功所以功不去，不爭所以無尤，不自見所以明。第 8 章與第 22 章各有一例。",
      "see": ["8.4", "22.4"]
    }
  ],
  "keywords": [
    { "term": "天下", "refs": ["2.1"] },
    { "term": "善", "refs": ["2.1"] },
    { "term": "有", "refs": ["2.2"] },
    { "term": "無", "refs": ["2.2"] },
    { "term": "和", "refs": ["2.2"] },
    { "term": "聖人", "refs": ["2.3"] },
    { "term": "無為", "refs": ["2.3"] },
    { "term": "萬物", "refs": ["2.4"] }
  ],
  "meta": {
    "status": "draft",
    "base": "王弼本",
    "updated": "2026-09-14",
    "todo": ["白話待口述改寫（目前為起草稿）"]
  }
}
