{
  "chapter": 12,
  "part": "道經",
  "gist": "五色令人目盲；聖人為腹不為目，去彼取此",
  "text": "五色令人目盲，五音令人耳聾，五味令人口爽，馳騁畋獵令人心發狂，難得之貨令人行妨。是以聖人為腹不為目，故去彼取此。",
  "segments": [
    {
      "id": "12.1",
      "text": "五色令人目盲，五音令人耳聾，五味令人口爽，馳騁畋獵令人心發狂，難得之貨令人行妨。",
      "plain": "繽紛的顏色看壞了眼睛，繁雜的聲音聽壞了耳朵，濃重的味道敗壞了口味，縱馬打獵讓人心發狂，難得的財貨讓人行為走樣。"
    },
    {
      "id": "12.2",
      "text": "是以聖人為腹不為目，故去彼取此。",
      "plain": "所以聖人只顧肚子，不顧眼睛：捨那個，取這個。"
    }
  ],
  "plain": "繽紛的顏色看壞了眼睛，繁雜的聲音聽壞了耳朵，濃重的味道敗壞了口味，縱馬打獵讓人心發狂，難得的財貨讓人行為走樣。所以聖人只顧肚子、不顧眼睛——捨那個，取這個。",
  "notes": [
    {
      "id": "n1",
      "ref": "12.1",
      "term": "爽",
      "type": "訓詁",
      "text": "爽在此是傷、敗壞（如「爽約」的爽），不是爽快。「口爽」是味覺壞掉——吃慣了重味，就嘗不出東西本來的味道。"
    },
    {
      "id": "n2",
      "ref": "12.1",
      "type": "義理",
      "text": "五句列的都是感官被過度餵養之後反而失能。老子的論點不是禁欲，而是指出一個現象：刺激愈強，感受力愈鈍——這與第 5 章「多言數窮」、第 9 章「持而盈之」是同一路，都是說滿了會反過來害自己。",
      "see": ["5.3", "9.1"]
    },
    {
      "id": "n3",
      "ref": "12.1",
      "term": "行妨",
      "type": "訓詁",
      "text": "妨是妨害。難得之貨令人行妨，是說稀有的東西會讓人的行為走樣——第 3 章「不貴難得之貨，使民不為盜」說的是同一件事的後果。",
      "see": ["3.1"]
    },
    {
      "id": "n4",
      "ref": "12.2",
      "term": "為腹不為目",
      "type": "互見",
      "text": "腹是身體實在的需要，目是向外追逐的慾望。與第 3 章「虛其心，實其腹」取捨完全一致：顧該顧的，不去餵那些愈餵愈餓的。",
      "see": ["3.2"]
    },
    {
      "id": "n5",
      "ref": "12.2",
      "term": "去彼取此",
      "type": "互見",
      "text": "「故去彼取此」四字與第 38 章末句同文。兩章取捨的內容不同（那裡是厚實與虛華，這裡是腹與目），但動作一樣：不是折衷，是二選一。",
      "see": ["38.8"]
    }
  ],
  "keywords": [
    { "term": "聖人", "refs": ["12.2"] }
  ],
  "meta": {
    "status": "draft",
    "base": "王弼本",
    "updated": "2026-09-14",
    "todo": ["白話待口述改寫（目前為起草稿）"]
  }
}
