{
  "chapter": 81,
  "part": "德經",
  "gist": "全書收束：信美、善辯、知博三組相反，終於利而不害、為而不爭",
  "text": "信言不美，美言不信。善者不辯，辯者不善。知者不博，博者不知。聖人不積，既以為人己愈有，既以與人己愈多。天之道，利而不害；聖人之道，為而不爭。",
  "segments": [
    {
      "id": "81.1",
      "text": "信言不美，美言不信。",
      "plain": "真實的話不漂亮，漂亮的話不真實。"
    },
    {
      "id": "81.2",
      "text": "善者不辯，辯者不善。",
      "plain": "善的人不爭辯，愛爭辯的人不善。"
    },
    {
      "id": "81.3",
      "text": "知者不博，博者不知。",
      "plain": "真懂的人不求雜，求雜的人不真懂。"
    },
    {
      "id": "81.4",
      "text": "聖人不積，既以為人己愈有，既以與人己愈多。",
      "plain": "聖人不囤積：越是拿來給人，自己越有；越是給出去，自己越多。"
    },
    {
      "id": "81.5",
      "text": "天之道，利而不害；聖人之道，為而不爭。",
      "plain": "天的道，利益萬物而不傷害；聖人的道，做事而不與人爭。"
    }
  ],
  "plain": "真實的話不漂亮，漂亮的話不真實；善的人不爭辯，愛爭辯的人不善；真懂的人不求雜博，求雜博的人並不真懂。三組話說的是同一件事：外表好看的那一邊，往往不是實的那一邊。聖人因此不囤積——越是拿出來給人，自己反而越有；越是給出去，自己反而越多。天的道是利益萬物而不傷害，聖人的道是做事而不與人爭。全書八十一章，收在這兩句上。",
  "notes": [
    {
      "id": "n1",
      "ref": "81.1",
      "term": "信言",
      "type": "訓詁",
      "text": "信是實。信言就是老實話。這裡不是說話難聽才算真，而是說修飾一多、為了好聽而遷就，實話就先折損了。"
    },
    {
      "id": "n2",
      "ref": "81.3",
      "term": "博",
      "type": "訓詁",
      "text": "博是廣、雜。這句不是反對多聞，而是反對以「什麼都知道」自炫——與第 48 章「為學日益，為道日損」同一個態度。",
      "see": ["48.1"]
    },
    {
      "id": "n3",
      "ref": "81.3",
      "type": "義理",
      "text": "三組對句（信／美、善／辯、知／博）是同一個結構的三次重複：凡是拿來給人看的那一面，往往不是實的那一面。連用三次是為了把它坐實成通則，好接下面的聖人。"
    },
    {
      "id": "n4",
      "ref": "81.4",
      "term": "既",
      "type": "訓詁",
      "text": "既訓為盡。「既以為人」是盡數拿出來給人，不是「既然」。"
    },
    {
      "id": "n5",
      "ref": "81.4",
      "term": "不積",
      "type": "義理",
      "text": "積是囤。這兩句把前面的「損之而益」推到最直白的地步：給出去不是損失，是讓自己更有——因為留得住的從來不是囤起來的東西。"
    },
    {
      "id": "n6",
      "ref": "81.5",
      "type": "互見",
      "text": "「利而不害」正是第 8 章水的「善利萬物而不爭」；「為而不爭」也回到第 8 章的「夫唯不爭，故無尤」。全書末章收在這裡，等於回頭認領了水那個比喻。",
      "see": ["8.2", "8.4"]
    },
    {
      "id": "n7",
      "ref": "81.5",
      "type": "異文",
      "text": "帛書本《老子》德經在前、道經在後，本章在帛書中並不是全書末章。所以「收束全書」這層讀法是就通行本的次序而言。",
      "source": "帛書本"
    }
  ],
  "keywords": [
    { "term": "善", "refs": ["81.2"] },
    { "term": "聖人", "refs": ["81.4", "81.5"] },
    { "term": "道", "refs": ["81.5"], "sense": "天之道與聖人之道對舉" },
    { "term": "不爭", "refs": ["81.5"] }
  ],
  "meta": {
    "status": "draft",
    "base": "王弼本",
    "updated": "2026-09-14",
    "todo": [
      "白話待口述改寫（目前為起草稿）"
    ]
  }
}
