{
  "chapter": 75,
  "part": "德經",
  "gist": "民之饑以其上食稅之多；三句都把原因指向「其上」",
  "text": "民之饑，以其上食稅之多，是以饑。民之難治，以其上之有為，是以難治。民之輕死，以其上求生之厚，是以輕死。夫唯無以生為者，是賢於貴生。",
  "segments": [
    {
      "id": "75.1",
      "text": "民之饑，以其上食稅之多，是以饑。",
      "plain": "百姓會餓，是因為上面吃掉的稅太多，所以才餓。"
    },
    {
      "id": "75.2",
      "text": "民之難治，以其上之有為，是以難治。",
      "plain": "百姓難治，是因為上面愛作為，所以才難治。"
    },
    {
      "id": "75.3",
      "text": "民之輕死，以其上求生之厚，是以輕死。",
      "plain": "百姓看輕死亡，是因為上面把自己的日子過得太厚，所以才看輕死。"
    },
    {
      "id": "75.4",
      "text": "夫唯無以生為者，是賢於貴生。",
      "plain": "只有不把「活著」當成一件要經營的事的人，才勝過那些看重養生的人。"
    }
  ],
  "plain": "百姓會餓，是因為上面吃掉的稅太多；百姓難治，是因為上面愛作為；百姓看輕死亡，是因為上面把自己的日子過得太厚。三件事的原因都在同一個地方。只有不把「活著」當成一件要經營的事的人，才勝過那些看重養生的人。",
  "notes": [
    {
      "id": "n1",
      "ref": "75.1",
      "type": "義理",
      "text": "三句的句式完全一樣，而且每一句都把原因指向「其上」——不是民不好，是上面。老子少有地連用三次同一結構，等於重複敲三下。第 53 章「朝甚除，田甚蕪，倉甚虛」是這三句的現場，第 77 章「損不足以奉有餘」是它的原理。",
      "see": ["53.3", "77.2"]
    },
    {
      "id": "n2",
      "ref": "75.2",
      "term": "有為",
      "type": "義理",
      "text": "「上之有為」是全書「無為」的反面用例，而且講得最實際：難治不是民風問題，是上面動作太多動出來的。第 57 章「我無為而民自化」是它的正面說法。",
      "see": ["57.4"]
    },
    {
      "id": "n3",
      "ref": "75.3",
      "term": "求生之厚",
      "type": "互見",
      "text": "與第 50 章「以其生生之厚」同一個語。那裡說的是個人養生過度反而走進死地，這裡說的是上位者把自己的日子過得太厚，逼得百姓連命都不當回事——同一個毛病，一個害己，一個害人。",
      "see": ["50.2"]
    },
    {
      "id": "n4",
      "ref": "75.4",
      "term": "無以生為",
      "type": "互見",
      "text": "不把「活著」當成一樁要經營的事業。第 55 章「益生曰祥」說給生命加料是不祥，第 7 章「天地所以能長且久者，以其不自生」說得更徹底——不為自己而活，反而活得長。",
      "see": ["55.5", "7.2"]
    }
  ],
  "keywords": [],
  "meta": {
    "status": "draft",
    "base": "王弼本",
    "updated": "2026-09-14",
    "todo": [
      "白話待口述改寫（目前為起草稿）",
      "本章沒有受控詞表內的關鍵詞（「有為」是無為的反面用例，未立詞），因此不在關鍵詞索引中——校稿時確認是否要為此立詞"
    ]
  }
}
