{
  "chapter": 10,
  "part": "道經",
  "gist": "六個「能……乎」的自問；生而不有、長而不宰，是謂玄德",
  "text": "載營魄抱一，能無離乎？專氣致柔，能嬰兒乎？滌除玄覽，能無疵乎？愛民治國，能無為乎？天門開闔，能為雌乎？明白四達，能無知乎？生之畜之，生而不有，為而不恃，長而不宰，是謂玄德。",
  "segments": [
    {
      "id": "10.1",
      "text": "載營魄抱一，能無離乎？",
      "plain": "讓魂魄合抱著那個「一」，能不散開嗎？"
    },
    {
      "id": "10.2",
      "text": "專氣致柔，能嬰兒乎？",
      "plain": "把氣聚起來、鬆到最柔，能像嬰兒那樣嗎？"
    },
    {
      "id": "10.3",
      "text": "滌除玄覽，能無疵乎？",
      "plain": "把心這面幽深的鏡子擦乾淨，能一點瑕疵都沒有嗎？"
    },
    {
      "id": "10.4",
      "text": "愛民治國，能無為乎？",
      "plain": "愛護百姓、治理國家，能做到不妄為嗎？"
    },
    {
      "id": "10.5",
      "text": "天門開闔，能為雌乎？",
      "plain": "感官這道門一開一關，能守在雌柔那一邊嗎？"
    },
    {
      "id": "10.6",
      "text": "明白四達，能無知乎？",
      "plain": "通達四方什麼都明白，能不用機巧嗎？"
    },
    {
      "id": "10.7",
      "text": "生之畜之，生而不有，為而不恃，長而不宰，是謂玄德。",
      "plain": "生出它、養著它：生養了卻不佔有，做成了卻不自恃，做了頭卻不宰制——這叫作玄德。"
    }
  ],
  "plain": "讓魂魄合抱著那個「一」，能不散開嗎？把氣聚起來、鬆到最柔，能像嬰兒那樣嗎？把心這面幽深的鏡子擦乾淨，能一點瑕疵都沒有嗎？愛護百姓、治理國家，能做到不妄為嗎？感官這道門一開一關，能守在雌柔那一邊嗎？通達四方什麼都明白，能不用機巧嗎？生出它、養著它，卻不佔有、不自恃、不宰制——這就叫玄德。",
  "notes": [
    {
      "id": "n1",
      "ref": "10.1",
      "term": "營魄抱一",
      "type": "互見",
      "text": "營魄即魂魄。「抱一」與第 22 章「聖人抱一為天下式」用的是同一個動作，第 39 章「昔之得一者」、第 42 章「道生一」則交代這個「一」是什麼。",
      "see": ["22.2", "39.1"]
    },
    {
      "id": "n2",
      "ref": "10.2",
      "term": "嬰兒",
      "type": "互見",
      "text": "嬰兒是老子最常用的正面取象：第 20 章「如嬰兒之未孩」取其未分別，第 28 章「復歸於嬰兒」取其歸宿，這裡取其柔。三處合看，嬰兒代表的不是幼稚，是還沒被加工的狀態。",
      "see": ["20.3", "28.1"]
    },
    {
      "id": "n3",
      "ref": "10.3",
      "term": "玄覽",
      "type": "異文",
      "text": "覽通「鑒」，玄覽即幽深的鏡子，指心。帛書本作「玄監」，監正是鑑的本字，可為佐證。把心當鏡子擦，是後世「明鏡」一路譬喻的源頭之一。",
      "source": "帛書本"
    },
    {
      "id": "n4",
      "ref": "10.5",
      "term": "為雌",
      "type": "互見",
      "text": "與第 28 章「知其雄，守其雌」同一個選擇。天門或指感官的開闔，或指氣息出入；無論哪一讀，要求都是同一個：在一開一關之間守住被動的那一邊。",
      "see": ["28.1"]
    },
    {
      "id": "n5",
      "ref": "10.6",
      "term": "無知",
      "type": "互見",
      "text": "「明白四達」與「無知」並列，正好說明老子的「無知」不是不懂：什麼都通達了，還能不動機巧，才是這句的要求。第 3 章「常使民無知無欲」的知也是這個意思。",
      "see": ["3.3"]
    },
    {
      "id": "n6",
      "ref": "10.7",
      "type": "互見",
      "text": "末段與第 51 章完全相同，那裡也叫「玄德」；第 2 章則作「功成而弗居」。同一組定式在三章出現，是老子認定的核心。",
      "see": ["51.5", "2.4"]
    },
    {
      "id": "n7",
      "ref": "10.1",
      "type": "義理",
      "text": "六個「能……乎」連問，全書僅此一章。不是設問也不是反詰，而是把功夫一項項擺出來問自己做不做得到——讀的時候一句一停，比連著讀有味道。"
    }
  ],
  "keywords": [
    { "term": "一", "refs": ["10.1"] },
    { "term": "無為", "refs": ["10.4"] },
    { "term": "知", "refs": ["10.6"], "sense": "此處無知指不用機巧" },
    { "term": "德", "refs": ["10.7"] },
    { "term": "玄", "refs": ["10.7"] }
  ],
  "meta": {
    "status": "draft",
    "base": "王弼本",
    "updated": "2026-09-14",
    "todo": ["白話待口述改寫（目前為起草稿）"]
  }
}
