{
  "chapter": 77,
  "part": "德經",
  "gist": "天之道損有餘而補不足，人之道損不足以奉有餘",
  "text": "天之道，其猶張弓與？高者抑之，下者舉之；有餘者損之，不足者補之。天之道，損有餘而補不足。人之道則不然，損不足以奉有餘。孰能有餘以奉天下？唯有道者。是以聖人為而不恃，功成而不處，其不欲見賢。",
  "segments": [
    {
      "id": "77.1",
      "text": "天之道，其猶張弓與？高者抑之，下者舉之；有餘者損之，不足者補之。",
      "plain": "天的道，不就像拉弓嗎？高了就壓低，低了就抬高；多了就減掉，不夠就補上。"
    },
    {
      "id": "77.2",
      "text": "天之道，損有餘而補不足。人之道則不然，損不足以奉有餘。",
      "plain": "天的道，是減掉有餘的去補不足的。人的道卻不是這樣：減掉不足的，拿去供奉有餘的。"
    },
    {
      "id": "77.3",
      "text": "孰能有餘以奉天下？唯有道者。",
      "plain": "誰能拿自己多出來的去供養天下？只有有道的人。"
    },
    {
      "id": "77.4",
      "text": "是以聖人為而不恃，功成而不處，其不欲見賢。",
      "plain": "所以聖人做了而不自恃，功成了而不佔著，他不想讓人看見自己賢能。"
    }
  ],
  "plain": "天的道，不就像拉弓嗎——高了就壓低，低了就抬高；多了就減掉，不夠就補上。天的道是減有餘、補不足；人的道偏偏相反：減掉本來就不足的，拿去供奉已經有餘的。誰能拿自己多出來的去供養天下？只有有道的人。所以聖人做了而不自恃，功成了而不佔著，他不想讓人看見自己賢能。",
  "notes": [
    {
      "id": "n1",
      "ref": "77.1",
      "term": "張弓",
      "type": "訓詁",
      "text": "張弓是上弦、拉弓。弦高了要往下壓，低了要往上抬，長了截短、短了接長——調整的方向永遠朝著讓兩端相稱。老子拿一個具體到手上的動作，說明「天之道」不是玄理。"
    },
    {
      "id": "n2",
      "ref": "77.2",
      "term": "損有餘而補不足",
      "type": "互見",
      "text": "「損」「益」這一對在第 42 章是處世的觀察（損之而益），在第 48 章是修為的方法（為道日損），到這裡成了衡量制度公不公的尺——同一組詞，三種用法。",
      "see": ["42.4", "48.1"]
    },
    {
      "id": "n3",
      "ref": "77.2",
      "term": "人之道則不然",
      "type": "義理",
      "text": "全書最尖銳的一句社會批評，而且是直說，沒有比喻：現實的分配方向與天道恰好相反——愈不足的愈被抽走，愈有餘的愈被供奉。老子少有地把「人之道」與「天之道」對立起來說。"
    },
    {
      "id": "n4",
      "ref": "77.4",
      "term": "為而不恃，功成而不處",
      "type": "互見",
      "text": "與第 2 章「為而不恃，功成而弗居」、第 51 章「生而不有，為而不恃」是同一組定式，第 9 章「功遂身退」則是它的行動版。此處接在「有餘以奉天下」之後，意思更清楚：連功勞都算多出來的那一份。",
      "see": ["2.4", "51.5", "9.4"]
    },
    {
      "id": "n5",
      "ref": "77.4",
      "term": "不欲見賢",
      "type": "訓詁",
      "text": "見通「現」，顯露。不想顯露自己賢能——與第 22 章「不自見，故明」、第 24 章「自見者不明」是同一個字、同一件事。",
      "see": ["22.3", "24.2"]
    }
  ],
  "keywords": [
    { "term": "道", "refs": ["77.1", "77.2", "77.3"], "sense": "天之道與人之道對立" },
    { "term": "損", "refs": ["77.1", "77.2"] },
    { "term": "天下", "refs": ["77.3"] },
    { "term": "聖人", "refs": ["77.4"] }
  ],
  "meta": {
    "status": "draft",
    "base": "王弼本",
    "updated": "2026-09-14",
    "todo": ["白話待口述改寫（目前為起草稿）"]
  }
}
